{"entries":[{"page":"pages/FactFreshnessStateMachineTest.md","tags":[{"display":"#导航/导航/主题/事实新鲜度","search":"tag:#导航/导航/主题/事实新鲜度","tag":"导航/主题/事实新鲜度"}]},{"page":"pages/SourceLinkRenderer.uri.md","tags":[{"display":"#导航/导航/主题/源码链接","search":"tag:#导航/导航/主题/源码链接","tag":"导航/主题/源码链接"}]},{"page":"pages/TagNavigationStateMachineTests.md","tags":[{"display":"#导航/导航/主题/tag状态机","search":"tag:#导航/导航/主题/tag状态机","tag":"导航/主题/tag状态机"}]},{"page":"pages/audit_obsidian.md","tags":[{"display":"#导航/导航/主题/obsidian审计","search":"tag:#导航/导航/主题/obsidian审计","tag":"导航/主题/obsidian审计"}]},{"page":"pages/audit_output_contract.md","tags":[{"display":"#导航/导航/主题/输出契约","search":"tag:#导航/导航/主题/输出契约","tag":"导航/主题/输出契约"}]},{"page":"pages/bind_conversation.md","tags":[{"display":"#导航/导航/主题/管理会话","search":"tag:#导航/导航/主题/管理会话","tag":"导航/主题/管理会话"}]},{"page":"pages/ingest_reference.md","tags":[{"display":"#导航/导航/主题/资料摄取","search":"tag:#导航/导航/主题/资料摄取","tag":"导航/主题/资料摄取"}]},{"page":"pages/query_graph.md","tags":[{"display":"#导航/导航/主题/graph查询","search":"tag:#导航/导航/主题/graph查询","tag":"导航/主题/graph查询"}]},{"page":"pages/register_obsidian_plugin.md","tags":[{"display":"#导航/导航/主题/插件注册","search":"tag:#导航/导航/主题/插件注册","tag":"导航/主题/插件注册"}]},{"page":"pages/retrieve_machine.md","tags":[{"display":"#导航/导航/主题/机器检索","search":"tag:#导航/导航/主题/机器检索","tag":"导航/主题/机器检索"}]},{"page":"pages/run_keyword_provider.md","tags":[{"display":"#导航/导航/主题/关键词provider","search":"tag:#导航/导航/主题/关键词provider","tag":"导航/主题/关键词provider"}]},{"page":"pages/sync_human_layer.md","tags":[{"display":"#导航/导航/主题/人类层同步","search":"tag:#导航/导航/主题/人类层同步","tag":"导航/主题/人类层同步"}]}],"excluded_by_state":{"candidate":2,"contested":2,"deprecated":2},"page_tag_limit":3,"production_integration":"disabled","schema_version":1,"status":"passed","suppressed":[]}
